<?xml version="1.0" encoding="UTF-8"?>
<?xml-stylesheet href="css/ejercicio-ii-1a-dtd" type="text/css"?>
<!-- ejercicio II.2a.xml -->
<!DOCTYPE fichero SYSTEM "dtd/ejercicioII.2a.dtd">
<fichero>
 <ficha>
  <nombre sexo="f" edad="17" >Angelina</nombre>
  <apellido>Fernandez</apellido>
  <direccion>c/Ulises, 36</direccion>
  <DUI>02020202-2</DUI>
  <contactos>
  <telefono tipo="celular">70000000</telefono>
  <facebook>Angelina Fernandez</facebook>
  <instagram>Angelina Fernandez</instagram>
  <twitter>@angelinafernandez50</twitter>
  </contactos>

 </ficha>
</fichero>